{
  "$schema": "../../../scripts/governance/schemas/product-authorization.schema.json",
  "id": "PCA-2026-089",
  "title": "Activación de Alux desde la personalización de rutas del Home",
  "status": "Approved",
  "branch": "fix/home-route-alux-action-20260910",
  "blueprint": "docs/blueprint/19.47-PREMIUM-TEMPLATE-PRESERVATION-AND-EVOLUTION-POLICY-v1.0.md",
  "founder_authority": "Autorización Founder del 2026-09-10 para corregir el botón existente Personalizar con Alux de las rutas del Home y hacer que abra el concierge con el contexto de la ruta seleccionada, sin rediseñar la sección, publicar ni desplegar.",
  "permissions": [
    {
      "operation": "modify",
      "path": "src/components/home-premium/HomePremiumSurface.tsx"
    },
    {
      "operation": "modify",
      "path": "src/lib/alux/floating-bus.ts"
    },
    {
      "operation": "modify",
      "path": "src/lib/alux/converse-contract.ts"
    },
    {
      "operation": "modify",
      "path": "src/components/alux/AluxConverseChat.tsx"
    },
    {
      "operation": "modify",
      "path": "src/lib/alux/converse.functions.ts"
    }
  ],
  "acknowledged_revisions": [
    {
      "operation": "modify",
      "path": "src/components/home-premium/HomePremiumSurface.tsx",
      "sha256": "5b3227aa4475c67dad172c33935f9bdcc781e896ef75b9a9c8f47e3a6f427b75",
      "authority": "Founder · activación funcional de Alux desde rutas · 2026-09-10"
    },
    {
      "operation": "modify",
      "path": "src/lib/alux/floating-bus.ts",
      "sha256": "c1412500c9c3bc73136a6dbb248b53d4559951e618c5709e48c8baeb2e5dc58e",
      "authority": "Founder · contexto completo de ruta para Alux · 2026-09-10"
    },
    {
      "operation": "modify",
      "path": "src/lib/alux/converse-contract.ts",
      "sha256": "b308ebe92c497b66bce250f91635bc73702dab2157245c1a0531670111228c92",
      "authority": "Founder · contexto completo de ruta para Alux · 2026-09-10"
    },
    {
      "operation": "modify",
      "path": "src/components/alux/AluxConverseChat.tsx",
      "sha256": "fa062207ebd8ba9247983f7bcd6bc32933266407c2d28103ab7ec65c97ec5795",
      "authority": "Founder · contexto completo de ruta para Alux · 2026-09-10"
    },
    {
      "operation": "modify",
      "path": "src/lib/alux/converse.functions.ts",
      "sha256": "77ef7ac78554ced5880a51d32ff8406c2b34294fe9ecbcd32ee1cdaae6bba463",
      "authority": "Founder · contexto completo de ruta para Alux · 2026-09-10"
    }
  ],
  "public_routes": ["/"],
  "required_feature_flags": [],
  "required_tests": ["Governance Integrity", "revisión funcional del botón Personalizar con Alux"]
}
