{
  "$schema": "../../../scripts/governance/schemas/product-authorization.schema.json",
  "id": "PCA-2026-076",
  "title": "Autoridad visual única de Home Premium",
  "status": "Approved",
  "branch": "fix/home-premium-authority-20260908",
  "blueprint": "docs/blueprint/19.47-PREMIUM-TEMPLATE-PRESERVATION-AND-EVOLUTION-POLICY-v1.0.md",
  "founder_authority": "Autorización Founder del 2026-09-08 para corregir la regresión de composición de Home: hacer Home Premium la única autoridad visual de la ruta pública y preview CMS, rechazar mezclas con bloques antiguos y conservar configuración CMS, Header, idiomas, acceso/registro, buscador, carrusel, Arma tu Viaje, Alux, mapa interactivo, navegación móvil y footer; validar 1440/834/430/390, pruebas específicas, typecheck y Governance; crear un PR separado y fusionar sólo con todo en PASS, sin publicar ni desplegar.",
  "permissions": [
    { "operation": "modify", "path": "src/routes/index.tsx" },
    { "operation": "modify", "path": "src/components/experience-builder/VisualStudio.tsx" },
    { "operation": "modify", "path": "src/components/home-premium/home-premium-config.ts" },
    { "operation": "create", "path": "src/lib/experience-builder/home-premium-authority.ts" },
    { "operation": "modify", "path": "src/lib/experience-builder/home-premium-authority.ts" }
  ],
  "acknowledged_revisions": [
    {
      "operation": "modify",
      "path": "src/routes/index.tsx",
      "sha256": "cba1b0f3cf7f8dfa68eb2c9fbb9aededadff32f297d2af988dc94b3f6033fc64",
      "authority": "Founder · Home Premium como autoridad pública única · 2026-09-08"
    },
    {
      "operation": "modify",
      "path": "src/components/experience-builder/VisualStudio.tsx",
      "sha256": "15e4dbd4087c22c0e55d8bfad695b9f7185258f8675a9447d39f4876f8ca29ce",
      "authority": "Founder · preview CMS comparte autoridad Home Premium · 2026-09-08"
    },
    {
      "operation": "modify",
      "path": "src/components/home-premium/home-premium-config.ts",
      "sha256": "93fdeea32f22a5a86346a0db5d5c826b15f9f3d08f7de775b844a2745e909b09",
      "authority": "Founder · aislamiento cerrado de la composición Premium · 2026-09-08"
    },
    {
      "operation": "create",
      "path": "src/lib/experience-builder/home-premium-authority.ts",
      "sha256": "4711d2717e0fc5b555f59899176039afec4f195c49182b2e5f183bdeddb23ecd",
      "authority": "Founder · reexportación trazable del resolutor único · 2026-09-08"
    },
    {
      "operation": "modify",
      "path": "src/lib/experience-builder/home-premium-authority.ts",
      "sha256": "4711d2717e0fc5b555f59899176039afec4f195c49182b2e5f183bdeddb23ecd",
      "authority": "Founder · consolidación del resolutor único · 2026-09-08"
    }
  ],
  "public_routes": ["/", "/cms/experience-builder"],
  "required_feature_flags": [],
  "required_tests": [
    "bun run test:r1:f1l:r2",
    "bun run typecheck",
    "bun run governance:check",
    "responsive 1440/834/430/390"
  ]
}
